{
  "schema_version": 1,
  "module": "ffuf",
  "hosts": [
    {
      "fqdn": "app.fixture-target.test",
      "level": 1,
      "parent": "fixture-target.test",
      "alive": false,
      "http_status": 200,
      "length": 18
    },
    {
      "fqdn": "dev.app.fixture-target.test",
      "level": 2,
      "parent": "app.fixture-target.test",
      "alive": true,
      "http_status": 200,
      "length": 9014
    },
    {
      "fqdn": "mail.app.fixture-target.test",
      "level": 2,
      "parent": "app.fixture-target.test",
      "alive": true,
      "http_status": 200,
      "length": 9014
    },
    {
      "fqdn": "staging.app.fixture-target.test",
      "level": 2,
      "parent": "app.fixture-target.test",
      "alive": true,
      "http_status": 200,
      "length": 9014
    },
    {
      "fqdn": "vpn.app.fixture-target.test",
      "level": 2,
      "parent": "app.fixture-target.test",
      "alive": true,
      "http_status": 200,
      "length": 9014
    },
    {
      "fqdn": "webmail.app.fixture-target.test",
      "level": 2,
      "parent": "app.fixture-target.test",
      "alive": true,
      "http_status": 200,
      "length": 9014
    },
    {
      "fqdn": "www.fixture-target.test",
      "level": 1,
      "parent": "fixture-target.test",
      "alive": true,
      "http_status": 200,
      "length": 18
    }
  ],
  "vhosts": [
    {
      "base_host": "app.fixture-target.test",
      "vhost": "mail.app.fixture-target.test",
      "alive": true,
      "http_status": 200,
      "length": 9014,
      "misconfig_suspect": true
    },
    {
      "base_host": "app.fixture-target.test",
      "vhost": "webmail.app.fixture-target.test",
      "alive": true,
      "http_status": 200,
      "length": 9014,
      "misconfig_suspect": true
    },
    {
      "base_host": "app.fixture-target.test",
      "vhost": "vpn.app.fixture-target.test",
      "alive": true,
      "http_status": 200,
      "length": 9014,
      "misconfig_suspect": true
    },
    {
      "base_host": "app.fixture-target.test",
      "vhost": "dev.app.fixture-target.test",
      "alive": true,
      "http_status": 200,
      "length": 9014,
      "misconfig_suspect": true
    },
    {
      "base_host": "app.fixture-target.test",
      "vhost": "staging.app.fixture-target.test",
      "alive": true,
      "http_status": 200,
      "length": 9014,
      "misconfig_suspect": true
    }
  ]
}
